{
  "name": "Giant Eagle",
  "size": "large",
  "creature_type": "beast",
  "alignment": "neutral good",
  "ability_scores": {
    "strength": 16,
    "dexterity": 17,
    "constitution": 13,
    "intelligence": 8,
    "wisdom": 14,
    "charisma": 10
  },
  "armor_class": 13,
  "max_hit_points": 26,
  "hit_dice": "4d10",
  "speed": {
    "walk": 10,
    "fly": 80
  },
  "proficiency_bonus": 2,
  "saving_throw_proficiencies": [],
  "damage_resistances": [],
  "damage_immunities": [],
  "damage_vulnerabilities": [],
  "condition_immunities": [],
  "senses": {},
  "passive_perception": 14,
  "actions": [
    {
      "name": "Beak",
      "description": "Melee Weapon Attack: +5 to hit, reach 5 ft., one target. Hit: 6 (1d6 + 3) piercing damage.",
      "action_type": "action",
      "target_type": "one_creature",
      "range": 5,
      "attack": {
        "name": "Beak",
        "attack_type": "melee_weapon",
        "ability": "strength",
        "reach": 5,
        "damage": [
          {
            "dice": "1d6",
            "damage_type": "piercing",
            "bonus": 3
          }
        ]
      }
    },
    {
      "name": "Talons",
      "description": "Melee Weapon Attack: +5 to hit, reach 5 ft., one target. Hit: 10 (2d6 + 3) slashing damage.",
      "action_type": "action",
      "target_type": "one_creature",
      "range": 5,
      "attack": {
        "name": "Talons",
        "attack_type": "melee_weapon",
        "ability": "strength",
        "reach": 5,
        "damage": [
          {
            "dice": "2d6",
            "damage_type": "slashing",
            "bonus": 3
          }
        ]
      }
    }
  ],
  "special_abilities": [
    {
      "name": "Multiattack",
      "description": "The eagle makes two attacks: one with its beak and one with its talons.",
      "extra_attack_count": 2
    },
    {
      "name": "Keen Sight",
      "description": "The eagle has advantage on Wisdom (Perception) checks that rely on sight."
    }
  ],
  "challenge_rating": 1.0,
  "experience_points": 200,
  "is_player_controlled": false
}