{
  "name": "Stone Giant",
  "size": "huge",
  "creature_type": "giant",
  "alignment": "neutral",
  "ability_scores": {
    "strength": 23,
    "dexterity": 15,
    "constitution": 20,
    "intelligence": 10,
    "wisdom": 12,
    "charisma": 9
  },
  "armor_class": 17,
  "max_hit_points": 126,
  "hit_dice": "11d12",
  "speed": {
    "walk": 40
  },
  "proficiency_bonus": 3,
  "saving_throw_proficiencies": [
    "dexterity",
    "constitution",
    "wisdom"
  ],
  "damage_resistances": [],
  "damage_immunities": [],
  "damage_vulnerabilities": [],
  "condition_immunities": [],
  "senses": {
    "darkvision": 60
  },
  "passive_perception": 14,
  "actions": [
    {
      "name": "Greatclub",
      "description": "Melee Weapon Attack: +9 to hit, reach 15 ft., one target. Hit: 19 (3d8 + 6) bludgeoning damage.",
      "action_type": "action",
      "target_type": "one_creature",
      "range": 15,
      "attack": {
        "name": "Greatclub",
        "attack_type": "melee_weapon",
        "ability": "strength",
        "reach": 15,
        "damage": [
          {
            "dice": "3d8",
            "damage_type": "bludgeoning",
            "bonus": 6
          }
        ]
      }
    },
    {
      "name": "Rock",
      "description": "Ranged Weapon Attack: +9 to hit, range 60/240 ft., one target. Hit: 28 (4d10 + 6) bludgeoning damage. If the target is a creature, it must succeed on a DC 17 Strength saving throw or be knocked prone.",
      "action_type": "action",
      "target_type": "one_creature",
      "range": 5,
      "attack": {
        "name": "Rock",
        "attack_type": "ranged_weapon",
        "ability": "strength",
        "reach": 5,
        "damage": [
          {
            "dice": "4d10",
            "damage_type": "bludgeoning",
            "bonus": 6
          }
        ]
      }
    }
  ],
  "special_abilities": [
    {
      "name": "Multiattack",
      "description": "The giant makes two greatclub attacks.",
      "extra_attack_count": 1
    },
    {
      "name": "Stone Camouflage",
      "description": "The giant has advantage on Dexterity (Stealth) checks made to hide in rocky terrain."
    }
  ],
  "challenge_rating": 7.0,
  "experience_points": 2900,
  "is_player_controlled": false
}