{
  "name": "Aboleth",
  "size": "large",
  "creature_type": "aberration",
  "alignment": "lawful evil",
  "ability_scores": {
    "strength": 21,
    "dexterity": 9,
    "constitution": 15,
    "intelligence": 18,
    "wisdom": 15,
    "charisma": 18
  },
  "armor_class": 17,
  "max_hit_points": 135,
  "hit_dice": "18d10",
  "speed": {
    "walk": 10,
    "swim": 40
  },
  "proficiency_bonus": 4,
  "saving_throw_proficiencies": [
    "constitution",
    "intelligence",
    "wisdom"
  ],
  "damage_resistances": [],
  "damage_immunities": [],
  "damage_vulnerabilities": [],
  "condition_immunities": [],
  "senses": {
    "darkvision": 120
  },
  "passive_perception": 20,
  "actions": [
    {
      "name": "Tentacle",
      "description": "Melee Weapon Attack: +9 to hit, reach 10 ft., one target. Hit: 12 (2d6 + 5) bludgeoning damage. If the target is a creature, it must succeed on a DC 14 Constitution saving throw or become diseased. The disease has no effect for 1 minute and can be removed by any magic that cures disease. After 1 minute, the diseased creature's skin becomes translucent and slimy, the creature can't regain hit points unless it is underwater, and the disease can be removed only by heal or another disease-curing spell of 6th level or higher. When the creature is outside a body of water, it takes 6 (1d12) acid damage every 10 minutes unless moisture is applied to the skin before 10 minutes have passed.",
      "action_type": "action",
      "target_type": "one_creature",
      "range": 10,
      "attack": {
        "name": "Tentacle",
        "attack_type": "melee_weapon",
        "ability": "strength",
        "reach": 10,
        "damage": [
          {
            "dice": "2d6",
            "damage_type": "bludgeoning",
            "bonus": 5
          },
          {
            "dice": "1d12",
            "damage_type": "acid",
            "bonus": 0
          }
        ]
      }
    },
    {
      "name": "Tail",
      "description": "Melee Weapon Attack: +9 to hit, reach 10 ft., one target. Hit: 15 (3d6 + 5) bludgeoning damage.",
      "action_type": "action",
      "target_type": "one_creature",
      "range": 10,
      "attack": {
        "name": "Tail",
        "attack_type": "melee_weapon",
        "ability": "strength",
        "reach": 10,
        "damage": [
          {
            "dice": "3d6",
            "damage_type": "bludgeoning",
            "bonus": 5
          }
        ]
      }
    },
    {
      "name": "Enslave",
      "description": "The aboleth targets one creature it can see within 30 ft. of it. The target must succeed on a DC 14 Wisdom saving throw or be magically charmed by the aboleth until the aboleth dies or until it is on a different plane of existence from the target. The charmed target is under the aboleth's control and can't take reactions, and the aboleth and the target can communicate telepathically with each other over any distance.\nWhenever the charmed target takes damage, the target can repeat the saving throw. On a success, the effect ends. No more than once every 24 hours, the target can also repeat the saving throw when it is at least 1 mile away from the aboleth.",
      "action_type": "action",
      "target_type": "one_creature",
      "saving_throw": {
        "ability": "wisdom",
        "dc": 14,
        "damage_on_fail": [],
        "damage_on_success": "none"
      }
    }
  ],
  "special_abilities": [
    {
      "name": "Multiattack",
      "description": "The aboleth makes three tentacle attacks.",
      "extra_attack_count": 3
    },
    {
      "name": "Amphibious",
      "description": "The aboleth can breathe air and water."
    },
    {
      "name": "Mucous Cloud",
      "description": "While underwater, the aboleth is surrounded by transformative mucus. A creature that touches the aboleth or that hits it with a melee attack while within 5 ft. of it must make a DC 14 Constitution saving throw. On a failure, the creature is diseased for 1d4 hours. The diseased creature can breathe only underwater."
    },
    {
      "name": "Probing Telepathy",
      "description": "If a creature communicates telepathically with the aboleth, the aboleth learns the creature's greatest desires if the aboleth can see the creature."
    }
  ],
  "challenge_rating": 10.0,
  "experience_points": 5900,
  "is_player_controlled": false
}