{
  "name": "Will-o'-Wisp",
  "size": "tiny",
  "creature_type": "undead",
  "alignment": "chaotic evil",
  "ability_scores": {
    "strength": 1,
    "dexterity": 28,
    "constitution": 10,
    "intelligence": 13,
    "wisdom": 14,
    "charisma": 11
  },
  "armor_class": 19,
  "max_hit_points": 22,
  "hit_dice": "9d4",
  "speed": {
    "walk": 0,
    "fly": 50
  },
  "proficiency_bonus": 2,
  "saving_throw_proficiencies": [],
  "damage_resistances": [
    "acid",
    "cold",
    "fire",
    "necrotic",
    "thunder",
    "bludgeoning, piercing, and slashing from nonmagical weapons"
  ],
  "damage_immunities": [
    "lightning",
    "poison"
  ],
  "damage_vulnerabilities": [],
  "condition_immunities": [
    "exhaustion",
    "grappled",
    "paralyzed",
    "poisoned",
    "prone",
    "restrained",
    "unconscious"
  ],
  "senses": {
    "darkvision": 120
  },
  "passive_perception": 12,
  "actions": [
    {
      "name": "Shock",
      "description": "Melee Spell Attack: +4 to hit, reach 5 ft., one creature. Hit: 9 (2d8) lightning damage.",
      "action_type": "action",
      "target_type": "one_creature",
      "range": 5,
      "attack": {
        "name": "Shock",
        "attack_type": "melee_weapon",
        "ability": "wisdom",
        "reach": 5,
        "damage": [
          {
            "dice": "2d8",
            "damage_type": "lightning",
            "bonus": 0
          }
        ]
      }
    }
  ],
  "legendary_actions": [],
  "legendary_action_count": 0,
  "special_abilities": [
    {
      "name": "Consume Life",
      "description": "As a bonus action, the will-o'-wisp can target one creature it can see within 5 ft. of it that has 0 hit points and is still alive. The target must succeed on a DC 10 Constitution saving throw against this magic or die. If the target dies, the will-o'-wisp regains 10 (3d6) hit points."
    },
    {
      "name": "Ephemeral",
      "description": "The will-o'-wisp can't wear or carry anything."
    },
    {
      "name": "Incorporeal Movement",
      "description": "The will-o'-wisp can move through other creatures and objects as if they were difficult terrain. It takes 5 (1d10) force damage if it ends its turn inside an object."
    },
    {
      "name": "Variable Illumination",
      "description": "The will-o'-wisp sheds bright light in a 5- to 20-foot radius and dim light for an additional number of ft. equal to the chosen radius. The will-o'-wisp can alter the radius as a bonus action."
    }
  ],
  "challenge_rating": 2.0,
  "experience_points": 450,
  "is_player_controlled": false
}