{
  "name": "Swarm of Ravens",
  "size": "medium",
  "creature_type": "humanoid",
  "alignment": "unaligned",
  "ability_scores": {
    "strength": 6,
    "dexterity": 14,
    "constitution": 8,
    "intelligence": 3,
    "wisdom": 12,
    "charisma": 6
  },
  "armor_class": 12,
  "max_hit_points": 24,
  "hit_dice": "7d8",
  "speed": {
    "walk": 10,
    "fly": 50
  },
  "proficiency_bonus": 2,
  "saving_throw_proficiencies": [],
  "damage_resistances": [
    "bludgeoning",
    "piercing",
    "slashing"
  ],
  "damage_immunities": [],
  "damage_vulnerabilities": [],
  "condition_immunities": [
    "charmed",
    "frightened",
    "grappled",
    "paralyzed",
    "petrified",
    "prone",
    "restrained",
    "stunned"
  ],
  "senses": {},
  "passive_perception": 15,
  "actions": [
    {
      "name": "Beaks",
      "description": "Melee Weapon Attack: +4 to hit, reach 5 ft., one target in the swarm's space. Hit: 7 (2d6) piercing damage, or 3 (1d6) piercing damage if the swarm has half of its hit points or fewer.",
      "action_type": "action",
      "target_type": "one_creature",
      "range": 5,
      "attack": {
        "name": "Beaks",
        "attack_type": "melee_weapon",
        "ability": "dexterity",
        "reach": 5,
        "damage": [
          {
            "dice": "2d6",
            "damage_type": "piercing",
            "bonus": 0
          }
        ]
      }
    }
  ],
  "legendary_actions": [],
  "legendary_action_count": 0,
  "special_abilities": [
    {
      "name": "Swarm",
      "description": "The swarm can occupy another creature's space and vice versa, and the swarm can move through any opening large enough for a Tiny raven. The swarm can't regain hit points or gain temporary hit points."
    }
  ],
  "challenge_rating": 0.25,
  "experience_points": 50,
  "is_player_controlled": false
}