{
  "name": "Lion",
  "size": "large",
  "creature_type": "beast",
  "alignment": "unaligned",
  "ability_scores": {
    "strength": 17,
    "dexterity": 15,
    "constitution": 13,
    "intelligence": 3,
    "wisdom": 12,
    "charisma": 8
  },
  "armor_class": 12,
  "max_hit_points": 26,
  "hit_dice": "4d10",
  "speed": {
    "walk": 50
  },
  "proficiency_bonus": 2,
  "saving_throw_proficiencies": [],
  "damage_resistances": [],
  "damage_immunities": [],
  "damage_vulnerabilities": [],
  "condition_immunities": [],
  "senses": {},
  "passive_perception": 13,
  "actions": [
    {
      "name": "Bite",
      "description": "Melee Weapon Attack: +5 to hit, reach 5 ft., one target. Hit: 7 (1d8 + 3) piercing damage.",
      "action_type": "action",
      "target_type": "one_creature",
      "range": 5,
      "attack": {
        "name": "Bite",
        "attack_type": "melee_weapon",
        "ability": "strength",
        "reach": 5,
        "damage": [
          {
            "dice": "1d8",
            "damage_type": "piercing",
            "bonus": 3
          }
        ]
      }
    },
    {
      "name": "Claw",
      "description": "Melee Weapon Attack: +5 to hit, reach 5 ft., one target. Hit: 6 (1d6 + 3) slashing damage.",
      "action_type": "action",
      "target_type": "one_creature",
      "range": 5,
      "attack": {
        "name": "Claw",
        "attack_type": "melee_weapon",
        "ability": "strength",
        "reach": 5,
        "damage": [
          {
            "dice": "1d6",
            "damage_type": "slashing",
            "bonus": 3
          }
        ]
      }
    }
  ],
  "legendary_actions": [],
  "legendary_action_count": 0,
  "special_abilities": [
    {
      "name": "Keen Smell",
      "description": "The lion has advantage on Wisdom (Perception) checks that rely on smell."
    },
    {
      "name": "Pack Tactics",
      "description": "The lion has advantage on an attack roll against a creature if at least one of the lion's allies is within 5 ft. of the creature and the ally isn't incapacitated.",
      "attack_advantage_when_ally_adjacent": true
    },
    {
      "name": "Pounce",
      "description": "If the lion moves at least 20 ft. straight toward a creature and then hits it with a claw attack on the same turn, that target must succeed on a DC 13 Strength saving throw or be knocked prone. If the target is prone, the lion can make one bite attack against it as a bonus action.",
      "on_hit_rider": {
        "trigger": "automatic",
        "once_per_turn": true,
        "requires_melee": true,
        "requires_charge_ft": 20,
        "save_ability": "strength",
        "save_dc_fixed": 13,
        "condition_on_fail": "prone",
        "condition_duration": "indefinite",
        "condition_save_to_end": false
      }
    },
    {
      "name": "Running Leap",
      "description": "With a 10-foot running start, the lion can long jump up to 25 ft.."
    }
  ],
  "challenge_rating": 1.0,
  "experience_points": 200,
  "is_player_controlled": false
}