{
  "name": "Winter Wolf",
  "size": "large",
  "creature_type": "monstrosity",
  "alignment": "neutral evil",
  "ability_scores": {
    "strength": 18,
    "dexterity": 13,
    "constitution": 14,
    "intelligence": 7,
    "wisdom": 12,
    "charisma": 8
  },
  "armor_class": 13,
  "max_hit_points": 75,
  "hit_dice": "10d10",
  "speed": {
    "walk": 50
  },
  "proficiency_bonus": 2,
  "saving_throw_proficiencies": [],
  "damage_resistances": [],
  "damage_immunities": [
    "cold"
  ],
  "damage_vulnerabilities": [],
  "condition_immunities": [],
  "senses": {},
  "passive_perception": 15,
  "actions": [
    {
      "name": "Bite",
      "description": "Melee Weapon Attack: +6 to hit, reach 5 ft., one target. Hit: 11 (2d6 + 4) piercing damage. If the target is a creature, it must succeed on a DC 14 Strength saving throw or be knocked prone.",
      "action_type": "action",
      "target_type": "one_creature",
      "range": 5,
      "attack": {
        "name": "Bite",
        "attack_type": "melee_weapon",
        "ability": "strength",
        "reach": 5,
        "damage": [
          {
            "dice": "2d6",
            "damage_type": "piercing",
            "bonus": 4
          }
        ]
      },
      "conditions_applied": [
        "prone"
      ],
      "condition_save_to_end": "strength",
      "condition_save_to_end_dc": 14,
      "condition_duration_type": "rounds",
      "condition_duration_rounds": 10
    },
    {
      "name": "Cold Breath",
      "description": "The wolf exhales a blast of freezing wind in a 15-foot cone. Each creature in that area must make a DC 12 Dexterity saving throw, taking 18 (4d8) cold damage on a failed save, or half as much damage on a successful one.",
      "action_type": "action",
      "target_type": "area_cone",
      "saving_throw": {
        "ability": "dexterity",
        "dc": 12,
        "damage_on_fail": [
          {
            "dice": "4d8",
            "damage_type": "cold",
            "bonus": 0
          }
        ],
        "damage_on_success": "none",
        "conditions_on_fail": []
      },
      "area_size": 15,
      "recharge_min": 5,
      "uses_per_rest": 1,
      "current_uses": 1,
      "ai_priority": 9
    }
  ],
  "legendary_actions": [],
  "legendary_action_count": 0,
  "special_abilities": [
    {
      "name": "Keen Hearing and Smell",
      "description": "The wolf has advantage on Wisdom (Perception) checks that rely on hearing or smell."
    },
    {
      "name": "Pack Tactics",
      "description": "The wolf has advantage on an attack roll against a creature if at least one of the wolf's allies is within 5 ft. of the creature and the ally isn't incapacitated.",
      "attack_advantage_when_ally_adjacent": true
    },
    {
      "name": "Snow Camouflage",
      "description": "The wolf has advantage on Dexterity (Stealth) checks made to hide in snowy terrain."
    }
  ],
  "challenge_rating": 3.0,
  "experience_points": 700,
  "is_player_controlled": false
}