{
  "name": "Goat",
  "size": "medium",
  "creature_type": "beast",
  "alignment": "unaligned",
  "ability_scores": {
    "strength": 12,
    "dexterity": 10,
    "constitution": 11,
    "intelligence": 2,
    "wisdom": 10,
    "charisma": 5
  },
  "armor_class": 10,
  "max_hit_points": 4,
  "hit_dice": "1d8",
  "speed": {
    "walk": 40
  },
  "proficiency_bonus": 2,
  "saving_throw_proficiencies": [],
  "damage_resistances": [],
  "damage_immunities": [],
  "damage_vulnerabilities": [],
  "condition_immunities": [],
  "senses": {},
  "passive_perception": 10,
  "actions": [
    {
      "name": "Ram",
      "description": "Melee Weapon Attack: +3 to hit, reach 5 ft., one target. Hit: 3 (1d4 + 1) bludgeoning damage.",
      "action_type": "action",
      "target_type": "one_creature",
      "range": 5,
      "attack": {
        "name": "Ram",
        "attack_type": "melee_weapon",
        "ability": "strength",
        "reach": 5,
        "damage": [
          {
            "dice": "1d4",
            "damage_type": "bludgeoning",
            "bonus": 1
          }
        ]
      }
    }
  ],
  "special_abilities": [
    {
      "name": "Charge",
      "description": "If the goat moves at least 20 ft. straight toward a target and then hits it with a ram attack on the same turn, the target takes an extra 2 (1d4) bludgeoning damage. If the target is a creature, it must succeed on a DC 10 Strength saving throw or be knocked prone."
    },
    {
      "name": "Sure-Footed",
      "description": "The goat has advantage on Strength and Dexterity saving throws made against effects that would knock it prone."
    }
  ],
  "challenge_rating": 0.0,
  "experience_points": 10,
  "is_player_controlled": false
}