{
  "name": "Water Elemental",
  "size": "large",
  "creature_type": "elemental",
  "alignment": "neutral",
  "ability_scores": {
    "strength": 18,
    "dexterity": 14,
    "constitution": 18,
    "intelligence": 5,
    "wisdom": 10,
    "charisma": 8
  },
  "armor_class": 14,
  "max_hit_points": 114,
  "hit_dice": "12d10",
  "speed": {
    "walk": 30,
    "swim": 90
  },
  "proficiency_bonus": 3,
  "saving_throw_proficiencies": [],
  "damage_resistances": [
    "acid",
    "bludgeoning, piercing, and slashing from nonmagical weapons"
  ],
  "damage_immunities": [
    "poison"
  ],
  "damage_vulnerabilities": [],
  "condition_immunities": [
    "exhaustion",
    "grappled",
    "paralyzed",
    "petrified",
    "poisoned",
    "prone",
    "restrained",
    "unconscious"
  ],
  "senses": {
    "darkvision": 60
  },
  "passive_perception": 10,
  "actions": [
    {
      "name": "Slam",
      "description": "Melee Weapon Attack: +7 to hit, reach 5 ft., one target. Hit: 13 (2d8 + 4) bludgeoning damage.",
      "action_type": "action",
      "target_type": "one_creature",
      "range": 5,
      "attack": {
        "name": "Slam",
        "attack_type": "melee_weapon",
        "ability": "strength",
        "reach": 5,
        "damage": [
          {
            "dice": "2d8",
            "damage_type": "bludgeoning",
            "bonus": 4
          }
        ]
      }
    },
    {
      "name": "Whelm",
      "description": "Each creature in the elemental's space must make a DC 15 Strength saving throw. On a failure, a target takes 13 (2d8 + 4) bludgeoning damage. If it is Large or smaller, it is also grappled (escape DC 14). Until this grapple ends, the target is restrained and unable to breathe unless it can breathe water. If the saving throw is successful, the target is pushed out of the elemental's space.\nThe elemental can grapple one Large creature or up to two Medium or smaller creatures at one time. At the start of each of the elemental's turns, each target grappled by it takes 13 (2d8 + 4) bludgeoning damage. A creature within 5 feet of the elemental can pull a creature or object out of it by taking an action to make a DC 14 Strength and succeeding.",
      "action_type": "action",
      "target_type": "one_creature",
      "saving_throw": {
        "ability": "strength",
        "dc": 15,
        "damage_on_fail": [
          {
            "dice": "2d8",
            "damage_type": "bludgeoning",
            "bonus": 4
          }
        ],
        "damage_on_success": "none"
      },
      "uses_per_rest": 2,
      "rest_type": "short",
      "current_uses": 2
    }
  ],
  "special_abilities": [
    {
      "name": "Multiattack",
      "description": "The elemental makes two slam attacks.",
      "extra_attack_count": 2
    },
    {
      "name": "Water Form",
      "description": "The elemental can enter a hostile creature's space and stop there. It can move through a space as narrow as 1 inch wide without squeezing."
    },
    {
      "name": "Freeze",
      "description": "If the elemental takes cold damage, it partially freezes; its speed is reduced by 20 ft. until the end of its next turn."
    }
  ],
  "challenge_rating": 5.0,
  "experience_points": 1800,
  "is_player_controlled": false
}