{
  "name": "Cat",
  "size": "tiny",
  "creature_type": "beast",
  "alignment": "unaligned",
  "ability_scores": {
    "strength": 3,
    "dexterity": 15,
    "constitution": 10,
    "intelligence": 3,
    "wisdom": 12,
    "charisma": 7
  },
  "armor_class": 12,
  "max_hit_points": 2,
  "hit_dice": "1d4",
  "speed": {
    "walk": 40,
    "climb": 30
  },
  "proficiency_bonus": 2,
  "saving_throw_proficiencies": [],
  "damage_resistances": [],
  "damage_immunities": [],
  "damage_vulnerabilities": [],
  "condition_immunities": [],
  "senses": {},
  "passive_perception": 13,
  "actions": [
    {
      "name": "Claws",
      "description": "Melee Weapon Attack: +0 to hit, reach 5 ft., one target. Hit: 1 slashing damage.",
      "action_type": "action",
      "target_type": "one_creature",
      "range": 5,
      "attack": {
        "name": "Claws",
        "attack_type": "melee_weapon",
        "ability": "charisma",
        "reach": 5,
        "damage": [
          {
            "dice": "1",
            "damage_type": "slashing",
            "bonus": 0
          }
        ]
      }
    }
  ],
  "special_abilities": [
    {
      "name": "Keen Smell",
      "description": "The cat has advantage on Wisdom (Perception) checks that rely on smell."
    }
  ],
  "challenge_rating": 0.0,
  "experience_points": 10,
  "is_player_controlled": false
}