{
  "name": "Xorn",
  "size": "medium",
  "creature_type": "elemental",
  "alignment": "neutral",
  "ability_scores": {
    "strength": 17,
    "dexterity": 10,
    "constitution": 22,
    "intelligence": 11,
    "wisdom": 10,
    "charisma": 11
  },
  "armor_class": 19,
  "max_hit_points": 73,
  "hit_dice": "7d8",
  "speed": {
    "walk": 20,
    "burrow": 20
  },
  "proficiency_bonus": 3,
  "saving_throw_proficiencies": [],
  "damage_resistances": [
    "piercing and slashing from nonmagical weapons that aren't adamantine"
  ],
  "damage_immunities": [],
  "damage_vulnerabilities": [],
  "condition_immunities": [],
  "senses": {
    "darkvision": 60,
    "tremorsense": 60
  },
  "passive_perception": 16,
  "actions": [
    {
      "name": "Bite",
      "description": "Melee Weapon Attack: +6 to hit, reach 5 ft., one target. Hit: 13 (3d6 + 3) piercing damage.",
      "action_type": "action",
      "target_type": "one_creature",
      "range": 5,
      "attack": {
        "name": "Bite",
        "attack_type": "melee_weapon",
        "ability": "strength",
        "reach": 5,
        "damage": [
          {
            "dice": "3d6",
            "damage_type": "piercing",
            "bonus": 3
          }
        ]
      }
    },
    {
      "name": "Claw",
      "description": "Melee Weapon Attack: +6 to hit, reach 5 ft., one target. Hit: 6 (1d6 + 3) slashing damage.",
      "action_type": "action",
      "target_type": "one_creature",
      "range": 5,
      "attack": {
        "name": "Claw",
        "attack_type": "melee_weapon",
        "ability": "strength",
        "reach": 5,
        "damage": [
          {
            "dice": "1d6",
            "damage_type": "slashing",
            "bonus": 3
          }
        ]
      }
    }
  ],
  "special_abilities": [
    {
      "name": "Multiattack",
      "description": "The xorn makes three claw attacks and one bite attack.",
      "extra_attack_count": 4
    },
    {
      "name": "Earth Glide",
      "description": "The xorn can burrow through nonmagical, unworked earth and stone. While doing so, the xorn doesn't disturb the material it moves through."
    },
    {
      "name": "Stone Camouflage",
      "description": "The xorn has advantage on Dexterity (Stealth) checks made to hide in rocky terrain."
    },
    {
      "name": "Treasure Sense",
      "description": "The xorn can pinpoint, by scent, the location of precious metals and stones, such as coins and gems, within 60 ft. of it."
    }
  ],
  "challenge_rating": 5.0,
  "experience_points": 1800,
  "is_player_controlled": false
}