{
  "name": "Young Gold Dragon",
  "size": "large",
  "creature_type": "dragon",
  "alignment": "lawful good",
  "ability_scores": {
    "strength": 23,
    "dexterity": 14,
    "constitution": 21,
    "intelligence": 16,
    "wisdom": 13,
    "charisma": 20
  },
  "armor_class": 18,
  "max_hit_points": 178,
  "hit_dice": "17d10",
  "speed": {
    "walk": 40,
    "fly": 80,
    "swim": 40
  },
  "proficiency_bonus": 4,
  "saving_throw_proficiencies": [
    "dexterity",
    "constitution",
    "wisdom",
    "charisma"
  ],
  "damage_resistances": [],
  "damage_immunities": [
    "fire"
  ],
  "damage_vulnerabilities": [],
  "condition_immunities": [],
  "senses": {
    "blindsight": 30,
    "darkvision": 120
  },
  "passive_perception": 19,
  "actions": [
    {
      "name": "Bite",
      "description": "Melee Weapon Attack: +10 to hit, reach 10 ft., one target. Hit: 17 (2d10 + 6) piercing damage.",
      "action_type": "action",
      "target_type": "one_creature",
      "range": 10,
      "attack": {
        "name": "Bite",
        "attack_type": "melee_weapon",
        "ability": "strength",
        "reach": 10,
        "damage": [
          {
            "dice": "2d10",
            "damage_type": "piercing",
            "bonus": 6
          }
        ]
      }
    },
    {
      "name": "Claw",
      "description": "Melee Weapon Attack: +10 to hit, reach 5 ft., one target. Hit: 13 (2d6 + 6) slashing damage.",
      "action_type": "action",
      "target_type": "one_creature",
      "range": 5,
      "attack": {
        "name": "Claw",
        "attack_type": "melee_weapon",
        "ability": "strength",
        "reach": 5,
        "damage": [
          {
            "dice": "2d6",
            "damage_type": "slashing",
            "bonus": 6
          }
        ]
      }
    }
  ],
  "special_abilities": [
    {
      "name": "Multiattack",
      "description": "The dragon makes three attacks: one with its bite and two with its claws.",
      "extra_attack_count": 3
    },
    {
      "name": "Amphibious",
      "description": "The dragon can breathe air and water."
    }
  ],
  "challenge_rating": 10.0,
  "experience_points": 5900,
  "is_player_controlled": false
}