{
  "name": "Cultist",
  "size": "medium",
  "creature_type": "humanoid",
  "alignment": "any non-good alignment",
  "ability_scores": {
    "strength": 11,
    "dexterity": 12,
    "constitution": 10,
    "intelligence": 10,
    "wisdom": 11,
    "charisma": 10
  },
  "armor_class": 12,
  "max_hit_points": 9,
  "hit_dice": "2d8",
  "speed": {
    "walk": 30
  },
  "proficiency_bonus": 2,
  "saving_throw_proficiencies": [],
  "damage_resistances": [],
  "damage_immunities": [],
  "damage_vulnerabilities": [],
  "condition_immunities": [],
  "senses": {},
  "passive_perception": 10,
  "actions": [
    {
      "name": "Scimitar",
      "description": "Melee Weapon Attack: +3 to hit, reach 5 ft., one creature. Hit: 4 (1d6 + 1) slashing damage.",
      "action_type": "action",
      "target_type": "one_creature",
      "range": 5,
      "attack": {
        "name": "Scimitar",
        "attack_type": "melee_weapon",
        "ability": "dexterity",
        "reach": 5,
        "damage": [
          {
            "dice": "1d6",
            "damage_type": "slashing",
            "bonus": 1
          }
        ]
      }
    }
  ],
  "legendary_actions": [],
  "legendary_action_count": 0,
  "special_abilities": [
    {
      "name": "Dark Devotion",
      "description": "The cultist has advantage on saving throws against being charmed or frightened.",
      "save_advantage_vs_conditions": [
        "frightened"
      ]
    }
  ],
  "challenge_rating": 0.125,
  "experience_points": 25,
  "is_player_controlled": false
}