{
  "name": "Tyrannosaurus Rex",
  "size": "huge",
  "creature_type": "beast",
  "alignment": "unaligned",
  "ability_scores": {
    "strength": 25,
    "dexterity": 10,
    "constitution": 19,
    "intelligence": 2,
    "wisdom": 12,
    "charisma": 9
  },
  "armor_class": 13,
  "max_hit_points": 136,
  "hit_dice": "13d12",
  "speed": {
    "walk": 50
  },
  "proficiency_bonus": 3,
  "saving_throw_proficiencies": [],
  "damage_resistances": [],
  "damage_immunities": [],
  "damage_vulnerabilities": [],
  "condition_immunities": [],
  "senses": {},
  "passive_perception": 14,
  "actions": [
    {
      "name": "Bite",
      "description": "Melee Weapon Attack: +10 to hit, reach 10 ft., one target. Hit: 33 (4d12 + 7) piercing damage. If the target is a Medium or smaller creature, it is grappled (escape DC 17). Until this grapple ends, the target is restrained, and the tyrannosaurus can't bite another target.",
      "action_type": "action",
      "target_type": "one_creature",
      "range": 10,
      "attack": {
        "name": "Bite",
        "attack_type": "melee_weapon",
        "ability": "strength",
        "reach": 10,
        "damage": [
          {
            "dice": "4d12",
            "damage_type": "piercing",
            "bonus": 7
          }
        ]
      }
    },
    {
      "name": "Tail",
      "description": "Melee Weapon Attack: +10 to hit, reach 10 ft., one target. Hit: 20 (3d8 + 7) bludgeoning damage.",
      "action_type": "action",
      "target_type": "one_creature",
      "range": 10,
      "attack": {
        "name": "Tail",
        "attack_type": "melee_weapon",
        "ability": "strength",
        "reach": 10,
        "damage": [
          {
            "dice": "3d8",
            "damage_type": "bludgeoning",
            "bonus": 7
          }
        ]
      }
    }
  ],
  "legendary_actions": [],
  "legendary_action_count": 0,
  "special_abilities": [
    {
      "name": "Multiattack",
      "description": "The tyrannosaurus makes two attacks: one with its bite and one with its tail. It can't make both attacks against the same target.",
      "extra_attack_count": 2
    }
  ],
  "challenge_rating": 8.0,
  "experience_points": 3900,
  "is_player_controlled": false
}