{
  "name": "Giant Elk",
  "size": "huge",
  "creature_type": "beast",
  "alignment": "unaligned",
  "ability_scores": {
    "strength": 19,
    "dexterity": 16,
    "constitution": 14,
    "intelligence": 7,
    "wisdom": 14,
    "charisma": 10
  },
  "armor_class": 14,
  "max_hit_points": 42,
  "hit_dice": "5d12",
  "speed": {
    "walk": 60
  },
  "proficiency_bonus": 2,
  "saving_throw_proficiencies": [],
  "damage_resistances": [],
  "damage_immunities": [],
  "damage_vulnerabilities": [],
  "condition_immunities": [],
  "senses": {},
  "passive_perception": 14,
  "actions": [
    {
      "name": "Ram",
      "description": "Melee Weapon Attack: +6 to hit, reach 10 ft., one target. Hit: 11 (2d6 + 4) bludgeoning damage.",
      "action_type": "action",
      "target_type": "one_creature",
      "range": 10,
      "attack": {
        "name": "Ram",
        "attack_type": "melee_weapon",
        "ability": "strength",
        "reach": 10,
        "damage": [
          {
            "dice": "2d6",
            "damage_type": "bludgeoning",
            "bonus": 4
          }
        ]
      }
    },
    {
      "name": "Hooves",
      "description": "Melee Weapon Attack: +6 to hit, reach 5 ft., one prone creature. Hit: 22 (4d8 + 4) bludgeoning damage.",
      "action_type": "action",
      "target_type": "one_creature",
      "range": 5,
      "attack": {
        "name": "Hooves",
        "attack_type": "melee_weapon",
        "ability": "strength",
        "reach": 5,
        "damage": [
          {
            "dice": "4d8",
            "damage_type": "bludgeoning",
            "bonus": 4
          }
        ]
      }
    }
  ],
  "special_abilities": [
    {
      "name": "Charge",
      "description": "If the elk moves at least 20 ft. straight toward a target and then hits it with a ram attack on the same turn, the target takes an extra 7 (2d6) damage. If the target is a creature, it must succeed on a DC 14 Strength saving throw or be knocked prone."
    }
  ],
  "challenge_rating": 2.0,
  "experience_points": 450,
  "is_player_controlled": false
}