{
  "name": "Adult Red Dragon",
  "size": "huge",
  "creature_type": "dragon",
  "alignment": "chaotic evil",
  "ability_scores": {
    "strength": 27,
    "dexterity": 10,
    "constitution": 25,
    "intelligence": 16,
    "wisdom": 13,
    "charisma": 21
  },
  "armor_class": 19,
  "max_hit_points": 256,
  "hit_dice": "19d12",
  "speed": {
    "walk": 40,
    "climb": 40,
    "fly": 80
  },
  "proficiency_bonus": 6,
  "saving_throw_proficiencies": [
    "dexterity",
    "constitution",
    "wisdom",
    "charisma"
  ],
  "damage_resistances": [],
  "damage_immunities": [
    "fire"
  ],
  "damage_vulnerabilities": [],
  "condition_immunities": [],
  "senses": {
    "blindsight": 60,
    "darkvision": 120
  },
  "passive_perception": 23,
  "actions": [
    {
      "name": "Bite",
      "description": "Melee Weapon Attack: +14 to hit, reach 10 ft., one target. Hit: 19 (2d10 + 8) piercing damage plus 7 (2d6) fire damage.",
      "action_type": "action",
      "target_type": "one_creature",
      "range": 10,
      "attack": {
        "name": "Bite",
        "attack_type": "melee_weapon",
        "ability": "strength",
        "reach": 10,
        "damage": [
          {
            "dice": "2d10",
            "damage_type": "piercing",
            "bonus": 8
          },
          {
            "dice": "2d6",
            "damage_type": "fire",
            "bonus": 0
          }
        ]
      }
    },
    {
      "name": "Claw",
      "description": "Melee Weapon Attack: +14 to hit, reach 5 ft., one target. Hit: 15 (2d6 + 8) slashing damage.",
      "action_type": "action",
      "target_type": "one_creature",
      "range": 5,
      "attack": {
        "name": "Claw",
        "attack_type": "melee_weapon",
        "ability": "strength",
        "reach": 5,
        "damage": [
          {
            "dice": "2d6",
            "damage_type": "slashing",
            "bonus": 8
          }
        ]
      }
    },
    {
      "name": "Tail",
      "description": "Melee Weapon Attack: +14 to hit, reach 15 ft., one target. Hit: 17 (2d8 + 8) bludgeoning damage.",
      "action_type": "action",
      "target_type": "one_creature",
      "range": 15,
      "attack": {
        "name": "Tail",
        "attack_type": "melee_weapon",
        "ability": "strength",
        "reach": 15,
        "damage": [
          {
            "dice": "2d8",
            "damage_type": "bludgeoning",
            "bonus": 8
          }
        ]
      }
    },
    {
      "name": "Frightful Presence",
      "description": "Each creature of the dragon's choice that is within 120 ft. of the dragon and aware of it must succeed on a DC 19 Wisdom saving throw or become frightened for 1 minute. A creature can repeat the saving throw at the end of each of its turns, ending the effect on itself on a success. If a creature's saving throw is successful or the effect ends for it, the creature is immune to the dragon's Frightful Presence for the next 24 hours.",
      "action_type": "action",
      "target_type": "one_creature",
      "saving_throw": {
        "ability": "wisdom",
        "dc": 19,
        "damage_on_fail": [],
        "damage_on_success": "none"
      }
    },
    {
      "name": "Fire Breath",
      "description": "The dragon exhales fire in a 60-foot cone. Each creature in that area must make a DC 21 Dexterity saving throw, taking 63 (18d6) fire damage on a failed save, or half as much damage on a successful one.",
      "action_type": "action",
      "target_type": "area_cone",
      "saving_throw": {
        "ability": "dexterity",
        "dc": 21,
        "damage_on_fail": [
          {
            "dice": "18d6",
            "damage_type": "fire",
            "bonus": 0
          }
        ],
        "damage_on_success": "none"
      },
      "area_size": 60,
      "uses_per_rest": 2,
      "rest_type": "short",
      "current_uses": 2
    }
  ],
  "special_abilities": [
    {
      "name": "Multiattack",
      "description": "The dragon can use its Frightful Presence. It then makes three attacks: one with its bite and two with its claws.",
      "extra_attack_count": 4
    },
    {
      "name": "Legendary Resistance",
      "description": "If the dragon fails a saving throw, it can choose to succeed instead."
    }
  ],
  "challenge_rating": 17.0,
  "experience_points": 18000,
  "is_player_controlled": false
}