{
  "name": "Constrictor Snake",
  "size": "large",
  "creature_type": "beast",
  "alignment": "unaligned",
  "ability_scores": {
    "strength": 15,
    "dexterity": 14,
    "constitution": 12,
    "intelligence": 1,
    "wisdom": 10,
    "charisma": 3
  },
  "armor_class": 12,
  "max_hit_points": 13,
  "hit_dice": "2d10",
  "speed": {
    "walk": 30,
    "swim": 30
  },
  "proficiency_bonus": 2,
  "saving_throw_proficiencies": [],
  "damage_resistances": [],
  "damage_immunities": [],
  "damage_vulnerabilities": [],
  "condition_immunities": [],
  "senses": {
    "blindsight": 10
  },
  "passive_perception": 10,
  "actions": [
    {
      "name": "Bite",
      "description": "Melee Weapon Attack: +4 to hit, reach 5 ft., one creature. Hit: 5 (1d6 + 2) piercing damage.",
      "action_type": "action",
      "target_type": "one_creature",
      "range": 5,
      "attack": {
        "name": "Bite",
        "attack_type": "melee_weapon",
        "ability": "strength",
        "reach": 5,
        "damage": [
          {
            "dice": "1d6",
            "damage_type": "piercing",
            "bonus": 2
          }
        ]
      }
    },
    {
      "name": "Constrict",
      "description": "Melee Weapon Attack: +4 to hit, reach 5 ft., one creature. Hit: 6 (1d8 + 2) bludgeoning damage, and the target is grappled (escape DC 14). Until this grapple ends, the creature is restrained, and the snake can't constrict another target.",
      "action_type": "action",
      "target_type": "one_creature",
      "range": 5,
      "attack": {
        "name": "Constrict",
        "attack_type": "melee_weapon",
        "ability": "strength",
        "reach": 5,
        "damage": [
          {
            "dice": "1d8",
            "damage_type": "bludgeoning",
            "bonus": 2
          }
        ]
      },
      "conditions_applied": [
        "grappled"
      ],
      "grapple_escape_dc": 14
    }
  ],
  "legendary_actions": [],
  "legendary_action_count": 0,
  "special_abilities": [],
  "challenge_rating": 0.25,
  "experience_points": 50,
  "is_player_controlled": false
}